### ISSUE TITLE
Retry on "Truncated"

### ISSUE THREAD

**Issue by klausenbusk** [skynetservices/skydns#260]
Hello

Digital Ocean currently have problems with Google DNS and OpenDNS in the AMS region.
So I played around and found a working DNS server and added it to the `nameservers` array.
```
curl -XPUT http://127.0.0.1:2379/v2/keys/skydns/config -d value='{"dns_addr":"0.0.0.0:53","nameservers": ["8.8.8.8:53","91.239.100.100:53"]}'`
```

and now half of the time DNS work.
Playing with dig I saw:
```
core@web ~ $ dig @172.17.42.1 -p 54 github.com
;; Truncated, retrying in TCP mode.
;; Connection to 172.17.42.1#54(172.17.42.1) for github.com failed: connection refused.
```
I would expect skydns to try with the secondary dns server, if the responds is truncated.

**Comment by miekg** [comment]
For truncated? Why do you expect this?

**Comment by klausenbusk** [comment]
> For truncated? Why do you expect this?

So my servers don't "crash".
A little testing shows that resolv.conf try the next server, but skydns does not.

**Comment by miekg** [comment]
[ Quoting <notifications@github.com> in "Re: [skydns] Retry on "Truncated" (..." ]
>A little testing shows that resolv.conf try the next server, but skydns does not.

For truncated response glibc will try the next server? Why would it do that?
The response would still be truncated in that case? 

What it *will* do is retry with tcp, maybe that is blocked here? And then skydns
should switch? It that the problem?

**Comment by klausenbusk** [comment]
> For truncated response glibc will try the next server? Why would it do that? The response would still be truncated in that case?

I don't know why glibc do that, it just do it :)

> What it *will* do is retry with tcp, maybe that is blocked here?

Hm, dig retry in tcp mode, ping (glibc?) does not (when using skydns). Switching to (8.8.8.8 and a working dns server in resolv.conf) and ping retry with the next server.

I'm not sure, how this should be resolved, or if it a issue with/in skydns or glibc, or anything :/

**Comment by klausenbusk** [comment]
DNS traffic with (ping works):
```
nameserver 8.8.8.8
nameserver 91.239.100.100
```
```
15:33:07.736176 IP 188.166.32.250.59666 > 8.8.8.8.domain: 8295+ A? dr.dk. (23)
	0x0000:  4500 0033 1597 4000 4011 3773 bca6 20fa  E..3..@.@.7s....
	0x0010:  0808 0808 e912 0035 001f ede0 2067 0100  .......5.....g..
	0x0020:  0001 0000 0000 0000 0264 7202 646b 0000  .........dr.dk..
	0x0030:  0100 01                                  ...
15:33:07.740006 IP 8.8.8.8.domain > 188.166.32.250.59666: 8295-| 0/0/0 (23)
	0x0000:  4500 0033 f497 0000 3311 a572 0808 0808  E..3....3..r....
	0x0010:  bca6 20fa 0035 e912 001f aa7d 2067 8300  .....5.....}.g..
	0x0020:  0001 0000 0000 0000 0264 7202 646b 0000  .........dr.dk..
	0x0030:  0100 01                                  ...
15:33:07.740590 IP 188.166.32.250.36919 > 91.239.100.100.domain: 8295+ A? dr.dk. (23)
	0x0000:  4500 0033 5064 4000 4011 4c62 bca6 20fa  E..3Pd@.@.Lb....
	0x0010:  5bef 6464 9037 0035 001f 9e24 2067 0100  [.dd.7.5...$.g..
	0x0020:  0001 0000 0000 0000 0264 7202 646b 0000  .........dr.dk..
	0x0030:  0100 01                                  ...
15:33:07.756496 IP 91.239.100.100.domain > 188.166.32.250.36919: 8295 1/3/3 A 159.20.6.38 (157)
	0x0000:  4500 00b9 8e10 0000 3b11 5330 5bef 6464  E.......;.S0[.dd
	0x0010:  bca6 20fa 0035 9037 00a5 de35 2067 8180  .....5.7...5.g..
	0x0020:  0001 0001 0003 0003 0264 7202 646b 0000  .........dr.dk..
	0x0030:  0100 01c0 0c00 0100 0100 0000 3700 049f  ............7...
	0x0040:  1406 26c0 0c00 0200 0100 0146 da00 0704  ..&........F....
	0x0050:  6e73 3031 c00c c00c 0002 0001 0001 46da  ns01..........F.
	0x0060:  0012 0664 6e73 3130 3205 7465 6c69 6103  ...dns102.telia.
	0x0070:  636f 6d00 c00c 0002 0001 0001 46da 0009  com.........F...
	0x0080:  0664 6e73 3130 31c0 4dc0 3300 0100 0100  .dns101.M.3.....
	0x0090:  014c 4300 04c3 89c2 24c0 6400 0100 0100  .LC.....$.d.....
	0x00a0:  000c 8a00 04c2 ff38 45c0 4600 0100 0100  .......8E.F.....
	0x00b0:  000c 8a00 04c2 ff38 46                   .......8F
15:33:07.771409 IP 188.166.32.250.53513 > 8.8.8.8.domain: 52748+ PTR? 38.6.20.159.in-addr.arpa. (42)
	0x0000:  4500 0046 159b 4000 4011 375c bca6 20fa  E..F..@.@.7\....
	0x0010:  0808 0808 d109 0035 0032 edf3 ce0c 0100  .......5.2......
	0x0020:  0001 0000 0000 0000 0233 3801 3602 3230  .........38.6.20
	0x0030:  0331 3539 0769 6e2d 6164 6472 0461 7270  .159.in-addr.arp
	0x0040:  6100 000c 0001                           a.....
15:33:07.775410 IP 8.8.8.8.domain > 188.166.32.250.53513: 52748-| 0/0/0 (42)
	0x0000:  4500 0046 ceee 0000 3311 cb08 0808 0808  E..F....3.......
	0x0010:  bca6 20fa 0035 d109 0032 0170 ce0c 8300  .....5...2.p....
	0x0020:  0001 0000 0000 0000 0233 3801 3602 3230  .........38.6.20
	0x0030:  0331 3539 0769 6e2d 6164 6472 0461 7270  .159.in-addr.arp
	0x0040:  6100 000c 0001                           a.....
15:33:07.775737 IP 188.166.32.250.55578 > 91.239.100.100.domain: 52748+ PTR? 38.6.20.159.in-addr.arpa. (42)
	0x0000:  4500 0046 5083 4000 4011 4c30 bca6 20fa  E..FP.@.@.L0....
	0x0010:  5bef 6464 d91a 0035 0032 9e37 ce0c 0100  [.dd...5.2.7....
	0x0020:  0001 0000 0000 0000 0233 3801 3602 3230  .........38.6.20
	0x0030:  0331 3539 0769 6e2d 6164 6472 0461 7270  .159.in-addr.arp
	0x0040:  6100 000c 0001                           a.....
15:33:07.791501 IP 91.239.100.100.domain > 188.166.32.250.55578: 52748 NXDomain 0/1/0 (96)
	0x0000:  4500 007c 8e18 0000 3b11 5365 5bef 6464  E..|....;.Se[.dd
	0x0010:  bca6 20fa 0035 d91a 0068 7555 ce0c 8183  .....5...huU....
	0x0020:  0001 0000 0001 0000 0233 3801 3602 3230  .........38.6.20
	0x0030:  0331 3539 0769 6e2d 6164 6472 0461 7270  .159.in-addr.arp
	0x0040:  6100 000c 0001 c014 0006 0001 0000 0cfa  a...............
	0x0050:  002a 017a 0461 7269 6e03 6e65 7400 0764  .*.z.arin.net..d
	0x0060:  6e73 2d6f 7073 c038 782a 3204 0000 0708  ns-ops.8x*2.....
	0x0070:  0000 0384 000a 8c00 0000 2a30            ..........*0
```
DNS traffic with (ping: unknown host dr.dk):
```
nameserver 172.17.42.1 (docker interface where skydns is listing with -nameservers 8.8.8.8:53,91.23100.100:53)
```
```
15:35:39.158510 IP 188.166.32.250.37157 > 8.8.8.8.domain: 44593+ A? dr.dk. (23)
	0x0000:  4500 0033 0fa3 4000 4011 3d67 bca6 20fa  E..3..@.@.=g....
	0x0010:  0808 0808 9125 0035 001f ede0 ae31 0100  .....%.5.....1..
	0x0020:  0001 0000 0000 0000 0264 7202 646b 0000  .........dr.dk..
	0x0030:  0100 01                                  ...
15:35:39.162650 IP 8.8.8.8.domain > 188.166.32.250.37157: 44593-| 0/0/0 (23)
	0x0000:  4500 0033 80a9 0000 3311 1961 0808 0808  E..3....3..a....
	0x0010:  bca6 20fa 0035 9125 001f 74a0 ae31 8300  .....5.%..t..1..
	0x0020:  0001 0000 0000 0000 0264 7202 646b 0000  .........dr.dk..
	0x0030:  0100 01                                  ...
15:35:39.163067 IP 188.166.32.250.35777 > 8.8.4.4.domain: 44593+ A? dr.dk. (23)
	0x0000:  4500 0033 330a 4000 4011 1e04 bca6 20fa  E..33.@.@.......
	0x0010:  0808 0404 8bc1 0035 001f e9dc ae31 0100  .......5.....1..
	0x0020:  0001 0000 0000 0000 0264 7202 646b 0000  .........dr.dk..
	0x0030:  0100 01                                  ...
15:35:39.167145 IP 8.8.4.4.domain > 188.166.32.250.35777: 44593-| 0/0/0 (23)
	0x0000:  4500 0033 1ef4 0000 3311 7f1a 0808 0404  E..3....3.......
	0x0010:  bca6 20fa 0035 8bc1 001f 7e08 ae31 8300  .....5....~..1..
	0x0020:  0001 0000 0000 0000 0264 7202 646b 0000  .........dr.dk..
	0x0030:  0100 01                                  ...
15:35:39.167673 IP 188.166.32.250.51306 > 8.8.8.8.domain: 44593+ A? dr.dk. (23)
	0x0000:  4500 0033 0fa9 4000 4011 3d61 bca6 20fa  E..3..@.@.=a....
	0x0010:  0808 0808 c86a 0035 001f ede0 ae31 0100  .....j.5.....1..
	0x0020:  0001 0000 0000 0000 0264 7202 646b 0000  .........dr.dk..
	0x0030:  0100 01                                  ...
15:35:39.171455 IP 8.8.8.8.domain > 188.166.32.250.51306: 44593-| 0/0/0 (23)
	0x0000:  4500 0033 8b73 0000 3311 0e97 0808 0808  E..3.s..3.......
	0x0010:  bca6 20fa 0035 c86a 001f 3d5b ae31 8300  .....5.j..=[.1..
	0x0020:  0001 0000 0000 0000 0264 7202 646b 0000  .........dr.dk..
	0x0030:  0100 01                                  ...
15:35:39.172162 IP 188.166.32.250.36875 > 8.8.4.4.domain: 44593+ A? dr.dk. (23)
	0x0000:  4500 0033 3312 4000 4011 1dfc bca6 20fa  E..33.@.@.......
	0x0010:  0808 0404 900b 0035 001f e9dc ae31 0100  .......5.....1..
	0x0020:  0001 0000 0000 0000 0264 7202 646b 0000  .........dr.dk..
	0x0030:  0100 01                                  ...
15:35:39.176438 IP 8.8.4.4.domain > 188.166.32.250.36875: 44593-| 0/0/0 (23)
	0x0000:  4500 0033 e39d 0000 3311 ba70 0808 0404  E..3....3..p....
	0x0010:  bca6 20fa 0035 900b 001f 79be ae31 8300  .....5....y..1..
	0x0020:  0001 0000 0000 0000 0264 7202 646b 0000  .........dr.dk..
	0x0030:  0100 01                                  ...
15:35:39.176876 IP 188.166.32.250.38041 > 8.8.8.8.domain: 44587+ A? dr.dk.screenpublisher.com. (43)
	0x0000:  4500 0047 0fae 4000 4011 3d48 bca6 20fa  E..G..@.@.=H....
	0x0010:  0808 0808 9499 0035 0033 edf4 ae2b 0100  .......5.3...+..
	0x0020:  0001 0000 0000 0000 0264 7202 646b 0f73  .........dr.dk.s
	0x0030:  6372 6565 6e70 7562 6c69 7368 6572 0363  creenpublisher.c
	0x0040:  6f6d 0000 0100 01                        om.....
15:35:39.180911 IP 8.8.8.8.domain > 188.166.32.250.38041: 44587-| 0/0/0 (43)
	0x0000:  4500 0047 2114 0000 3311 78e2 0808 0808  E..G!...3.x.....
	0x0010:  bca6 20fa 0035 9499 0033 fcd7 ae2b 8300  .....5...3...+..
	0x0020:  0001 0000 0000 0000 0264 7202 646b 0f73  .........dr.dk.s
	0x0030:  6372 6565 6e70 7562 6c69 7368 6572 0363  creenpublisher.c
	0x0040:  6f6d 0000 0100 01                        om.....
15:35:39.181456 IP 188.166.32.250.56361 > 8.8.4.4.domain: 44587+ A? dr.dk.screenpublisher.com. (43)
	0x0000:  4500 0047 3319 4000 4011 1de1 bca6 20fa  E..G3.@.@.......
	0x0010:  0808 0404 dc29 0035 0033 e9f0 ae2b 0100  .....).5.3...+..
	0x0020:  0001 0000 0000 0000 0264 7202 646b 0f73  .........dr.dk.s
	0x0030:  6372 6565 6e70 7562 6c69 7368 6572 0363  creenpublisher.c
	0x0040:  6f6d 0000 0100 01                        om.....
15:35:39.185175 IP 8.8.4.4.domain > 188.166.32.250.56361: 44587-| 0/0/0 (43)
	0x0000:  4500 0047 32e9 0000 3311 6b11 0808 0404  E..G2...3.k.....
	0x0010:  bca6 20fa 0035 dc29 0033 b94b ae2b 8300  .....5.).3.K.+..
	0x0020:  0001 0000 0000 0000 0264 7202 646b 0f73  .........dr.dk.s
	0x0030:  6372 6565 6e70 7562 6c69 7368 6572 0363  creenpublisher.c
	0x0040:  6f6d 0000 0100 01                        om.....
15:35:39.185892 IP 188.166.32.250.46654 > 8.8.8.8.domain: 44587+ A? dr.dk.screenpublisher.com. (43)
	0x0000:  4500 0047 0fb7 4000 4011 3d3f bca6 20fa  E..G..@.@.=?....
	0x0010:  0808 0808 b63e 0035 0033 edf4 ae2b 0100  .....>.5.3...+..
	0x0020:  0001 0000 0000 0000 0264 7202 646b 0f73  .........dr.dk.s
	0x0030:  6372 6565 6e70 7562 6c69 7368 6572 0363  creenpublisher.c
	0x0040:  6f6d 0000 0100 01                        om.....
15:35:39.189869 IP 8.8.8.8.domain > 188.166.32.250.46654: 44587-| 0/0/0 (43)
	0x0000:  4500 0047 6bd9 0000 3311 2e1d 0808 0808  E..Gk...3.......
	0x0010:  bca6 20fa 0035 b63e 0033 db32 ae2b 8300  .....5.>.3.2.+..
	0x0020:  0001 0000 0000 0000 0264 7202 646b 0f73  .........dr.dk.s
	0x0030:  6372 6565 6e70 7562 6c69 7368 6572 0363  creenpublisher.c
	0x0040:  6f6d 0000 0100 01                        om.....
15:35:39.190343 IP 188.166.32.250.40695 > 8.8.4.4.domain: 44587+ A? dr.dk.screenpublisher.com. (43)
	0x0000:  4500 0047 331a 4000 4011 1de0 bca6 20fa  E..G3.@.@.......
	0x0010:  0808 0404 9ef7 0035 0033 e9f0 ae2b 0100  .......5.3...+..
	0x0020:  0001 0000 0000 0000 0264 7202 646b 0f73  .........dr.dk.s
	0x0030:  6372 6565 6e70 7562 6c69 7368 6572 0363  creenpublisher.c
	0x0040:  6f6d 0000 0100 01                        om.....
15:35:39.194093 IP 8.8.4.4.domain > 188.166.32.250.40695: 44587-| 0/0/0 (43)
	0x0000:  4500 0047 054c 0000 3311 98ae 0808 0404  E..G.L..3.......
	0x0010:  bca6 20fa 0035 9ef7 0033 f67d ae2b 8300  .....5...3.}.+..
	0x0020:  0001 0000 0000 0000 0264 7202 646b 0f73  .........dr.dk.s
	0x0030:  6372 6565 6e70 7562 6c69 7368 6572 0363  creenpublisher.c
	0x0040:  6f6d 0000 0100 01                        om.....
```

Recorded with `tcpdump -n -s0 -x -X port 53`

**Comment by miekg** [comment]
But google keeps replying with an empty response:
~~~
15:35:39.176438 IP 8.8.4.4.domain > 188.166.32.250.36875: 44593-| 0/0/0 (23)
    0x0000:  4500 0033 e39d 0000 3311 ba70 0808 0404  E..3....3..p....
    0x0010:  bca6 20fa 0035 900b 001f 79be ae31 8300  .....5....y..1..
    0x0020:  0001 0000 0000 0000 0264 7202 646b 0000  .........dr.dk..
    0x0030:  0100 01   
~~~

**Comment by klausenbusk** [comment]
> But google keeps replying with an empty response:

Shouldn't skydns try the next server in the list  then? as glibc does?

**Comment by miekg** [comment]
Can you provide some dig output of some of these failing responses?
Somewhat easier to reason than the tcpdumps
On 17 Mar 2016 3:46 p.m., "Kristian Klausen" <notifications@github.com>
wrote:

But google keeps replying with an empty response:

Shouldn't skydns try the next server in the list then? as glibc does?

—
You are receiving this because you commented.

Reply to this email directly or view it on GitHub
<https://github.com/skynetservices/skydns/issues/260#issuecomment-197940937>

**Comment by klausenbusk** [comment]
> Can you provide some dig output of some of these failing responses?

```
core@web ~ $ dig @172.17.42.1 -p 54 github.com
;; Truncated, retrying in TCP mode.
;; Connection to 172.17.42.1#54(172.17.42.1) for github.com failed: connection refused.
```

**Comment by klausenbusk** [comment]
Sorry, that was a old try.
> Can you provide some dig output of some of these failing responses?

```
core@web1 ~ $ dig @172.17.42.1 -p 53 github.com
;; Truncated, retrying in TCP mode.

; <<>> DiG 9.10.2-P2 <<>> @172.17.42.1 -p 53 github.com
; (1 server found)
;; global options: +cmd
;; Got answer:
;; ->>HEADER<<- opcode: QUERY, status: NOERROR, id: 3315
;; flags: qr rd ra; QUERY: 1, ANSWER: 1, AUTHORITY: 4, ADDITIONAL: 5

;; OPT PSEUDOSECTION:
; EDNS: version: 0, flags:; udp: 4096
;; QUESTION SECTION:
;github.com.			IN	A

;; ANSWER SECTION:
github.com.		8	IN	A	192.30.252.128

;; AUTHORITY SECTION:
github.com.		66234	IN	NS	ns3.p16.dynect.net.
github.com.		66234	IN	NS	ns1.p16.dynect.net.
github.com.		66234	IN	NS	ns4.p16.dynect.net.
github.com.		66234	IN	NS	ns2.p16.dynect.net.

;; ADDITIONAL SECTION:
ns1.p16.dynect.net.	37233	IN	A	208.78.70.16
ns2.p16.dynect.net.	37233	IN	A	204.13.250.16
ns3.p16.dynect.net.	37233	IN	A	208.78.71.16
ns4.p16.dynect.net.	37233	IN	A	204.13.251.16

;; Query time: 32 msec
;; SERVER: 172.17.42.1#53(172.17.42.1)
;; WHEN: Thu Mar 17 20:16:55 UTC 2016
;; MSG SIZE  rcvd: 205
```

I don't think glibc retry in TCP mode.

**Comment by miekg** [comment]
[ Quoting <notifications@github.com> in "Re: [skydns] Retry on "Truncated" (..." ]
>Sorry, that was a old try.
>> Can you provide some dig output of some of these failing responses?
>
>core@web1 ~ $ dig @172.17.42.1 -p 53 github.com
>;; Truncated, retrying in TCP mode.

interesting.... Why would skydns set truncated on this response...?

~~~
>;; MSG SIZE  rcvd: 205
~~~

Size is tiny, it is possible to correlate this to the actual upstream query
performed by skydns? If at all possible in a dig-like format, or some extended
decode tcpdump?


>```
>
>; <<>> DiG 9.10.2-P2 <<>> @172.17.42.1 -p 53 github.com
>; (1 server found)
>;; global options: +cmd
>;; Got answer:
>;; ->>HEADER<<- opcode: QUERY, status: NOERROR, id: 3315
>;; flags: qr rd ra; QUERY: 1, ANSWER: 1, AUTHORITY: 4, ADDITIONAL: 5
>
>;; OPT PSEUDOSECTION:
>; EDNS: version: 0, flags:; udp: 4096
>;; QUESTION SECTION:
>;github.com.			IN	A
>
>;; ANSWER SECTION:
>github.com.		8	IN	A	192.30.252.128
>
>;; AUTHORITY SECTION:
>github.com.		66234	IN	NS	ns3.p16.dynect.net.
>github.com.		66234	IN	NS	ns1.p16.dynect.net.
>github.com.		66234	IN	NS	ns4.p16.dynect.net.
>github.com.		66234	IN	NS	ns2.p16.dynect.net.
>
>;; ADDITIONAL SECTION:
>ns1.p16.dynect.net.	37233	IN	A	208.78.70.16
>ns2.p16.dynect.net.	37233	IN	A	204.13.250.16
>ns3.p16.dynect.net.	37233	IN	A	208.78.71.16
>ns4.p16.dynect.net.	37233	IN	A	204.13.251.16
>
>;; Query time: 32 msec
>;; SERVER: 172.17.42.1#53(172.17.42.1)
>;; WHEN: Thu Mar 17 20:16:55 UTC 2016
>;; MSG SIZE  rcvd: 205
>```
>
>I don't think glibc retry in TCP mode.
>
>---
>You are receiving this because you commented.
>Reply to this email directly or view it on GitHub:
>https://github.com/skynetservices/skydns/issues/260#issuecomment-198065336
/Miek

--
Miek Gieben

**Comment by klausenbusk** [comment]
> Size is tiny, it is possible to correlate this to the actual upstream query performed by skydns?

I'm not 100% sure what you asking. Digital Ocean had some sort of DNS problem when using Google DNS, I would expect Skydns to try with the next NS if the first return a truncated result (I think that is what glibc do, at least tcpdump show that).

**Comment by miekg** [comment]
[ Quoting <notifications@github.com> in "Re: [skydns] Retry on "Truncated" (..." ]
>> Size is tiny, it is possible to correlate this to the actual upstream query performed by skydns?
>
>I'm not 100% sure what you asking. Digital Ocean had some sort of DNS problem when using Google DNS, I would expect Skydns to try with the next NS if the first return a truncated result (I think that is what glibc do, at least tcpdump show that).

Really? Because getting truncated is not reason to try a *different* DNS. It is
reason to retry the query with TCP (and maybe glibc than also change NSs, but
that's weird-ish). SkyDNS does not do this, because if the client does not retry
the query over tcp there is *no* possible way skydns could ever fit the large
TCP response in the origin UDP buffer of the client.

**Comment by klausenbusk** [comment]
Dunno, I don't know enough about DNS/glibc.

I just saw that due to Digital Ocean dns trouble, everything "blow" up (dns didn't work at all). Even when I forwarded the tcp port and added a extra working DNS server, only 50% of the request succeed.

But if I added that two dns servers to /etc/resolv.conf all DNS request succeed.

I don't know why. Do you have any idea?
