### ISSUE TITLE
Server not responding from address on which it was queried

### ISSUE THREAD

**Issue by njhartwell** [skynetservices/skydns#23]
I'm running skydns2 on an instance with multiple ips (10.0.10.10 and 10.0.10.11) and it's configured to listen on 0.0.0.0:53. Regardless of whether I query it at .10 or .11, it responds from the .11 address (which the client either drops or never receives when it's querying the .10 address) -- here's the tcpdump. I'm new to Go and can't figure out if it's possible to get the destination address of a received UDP packet, so please forgive me if this isn't currently possible to implement.

18:50:23.529981 IP 10.11.0.6.49372 > 10.0.10.10.domain: 54270+ A? google.com. (28)
18:50:23.530212 IP 10.0.10.11.59249 > 10.0.0.2.domain: 54270+ A? google.com. (28)
18:50:23.531308 IP 10.0.0.2.domain > 10.0.10.11.59249: 54270 11/0/0 A 173.194.121.6, A 173.194.121.7, A 173.194.121.8, A 173.194.121.9, A 173.194.121.14, A 173.194.121.0, A 173.194.121.1, A 173.194.121.2, A 173.194.121.3, A 173.194.121.4, A 173.194.121.5 (204)
18:50:23.531525 IP 10.0.10.11.domain > 10.11.0.6.49372: 54270 11/0/0 A 173.194.121.6, A 173.194.121.7, A 173.194.121.8, A 173.194.121.9, A 173.194.121.14, A 173.194.121.0, A 173.194.121.1, A 173.194.121.2, A 173.194.121.3, A 173.194.121.4, A 173.194.121.5 (314)

Thanks!
